,SKU Code,Description,,Unit Price
Proof that P=NP,WS123,"Break public key encryption today!  Wow your friends, evesdrop on ssh sessions, make computer scientists weep!",23,49.99
Universal Turing Machine,HW34523,"Compute all the things.  Sure it might take a while, but if you can compute it, this bad boy will get the answer eventually.",2345,99.99
Tables - The Only HTML Book You'll Ever Need,B1234,"DIVs, Spans, CSS…who needs that stuff when you have tables!  Nest them till you're heart is content and achieve layouts to wow even the most seasoned web developer",34,12.99
8K monitor,HW54523,Now with twice as many Ks,12,23
Air,MS98,Fresh air for your cube,567,0